{
  "$schema": "http://json-schema.org/draft-07/schema#",
  "$id": "architecture-pattern-schema",
  "title": "ArchitecturePattern",
  "description": "Schema for architecture pattern definitions",
  "type": "object",
  "required": [
    "category",
    "name",
    "context",
    "benefits",
    "tradeoffs",
    "quality_attributes"
  ],
  "definitions": {
    "architectureDomain": {
      "type": "string",
      "enum": [
        "activity-feeds",
        "ai-agent-orchestration",
        "ai-products",
        "always-online-desktop-apps",
        "anomaly-detection",
        "api-gateways",
        "application-servers",
        "applications-needing-complex-cross-shard-joins",
        "applications-planning-eventual-extraction-to-microservices",
        "applications-with-identical-client-needs",
        "artificial-intelligence",
        "audit-regulatory",
        "audit-trail-requirements",
        "autonomic-systems",
        "autonomous-mobile-robots",
        "autonomous-systems",
        "autonomous-vehicles",
        "b2b-integration",
        "backend-for-frontend",
        "backup-and-disaster-recovery-scenarios",
        "banking-and-finance",
        "batch-analytics-only",
        "batch-processing",
        "betting-and-wagering-systems",
        "big-data-analytics",
        "cases-where-technology-stack-heterogeneity-is-critical",
        "ci-cd-environments",
        "clickstream-analytics",
        "cloud-first-mandate-with-no-regulatory-barriers",
        "cloud-native",
        "cloud-native-applications",
        "cloud-native-applications-on-kubernetes",
        "cloud-native-native",
        "collaborative-applications",
        "collaborative-domains",
        "companies-undertaking-multi-year-cloud-migration-journeys",
        "compiler-toolchains",
        "complex-business-logic",
        "complex-domain",
        "complex-domain-driven",
        "complex-domains",
        "complex-interactive-systems",
        "complex-local-testing",
        "complex-scheduling",
        "complex-window-functions-over-full-history",
        "compliance",
        "content-management-systems",
        "cost-sensitive-storage",
        "cpu-bound-computation",
        "cross-language-platforms",
        "cross-organizational",
        "cross-platform-integration",
        "crud-applications",
        "data-driven-web-applications",
        "data-intensive-workloads",
        "data-pipelines",
        "data-processing",
        "data-science-platforms",
        "data-transformation-pipelines",
        "decision-support-systems",
        "desktop-applications",
        "direct-network-access-sufficient",
        "disaster-recovery",
        "distributed-data-pipelines",
        "distributed-transactions",
        "domain-driven-design",
        "e-commerce",
        "e-commerce-flash-sales",
        "e-commerce-order-processing",
        "e-commerce-platforms",
        "e-commerce-platforms-with-multiple-product-categories",
        "early-stage-products-with-unclear-service-boundaries",
        "early-stage-startups",
        "edge-computing-bandwidth",
        "energy",
        "enterprise",
        "enterprise-application-integration",
        "enterprise-applications",
        "enterprise-applications-with-distinct-business-capabilities",
        "enterprise-integration",
        "enterprise-saas",
        "enterprise-scale",
        "enterprise-software",
        "enterprise-systems-needing-centralized-governance",
        "enterprise-web",
        "erp-crm",
        "etl",
        "event-driven-architectures",
        "event-driven-microservices",
        "event-driven-systems",
        "event-driven-workflows",
        "event-driven-workloads",
        "expert-systems",
        "extensible-applications",
        "extreme-low-latency",
        "few-services",
        "file-processing",
        "finance-banking",
        "financial",
        "financial-compliance",
        "financial-services",
        "financial-systems",
        "financial-trading",
        "financial-trading-platforms",
        "fintech",
        "fixed-predictable-volumes",
        "flat-screen-based-interfaces",
        "fraud-detection",
        "frequently-correcting-data",
        "game-ui-architectures",
        "gaming-servers",
        "geographical-expansion-without-building-datacenters",
        "general",
        "global-distribution",
        "government",
        "government-systems",
        "gpu-specialized-hardware",
        "greenfield-microservices",
        "greenfield-projects-with-no-legacy-constraints",
        "greenfield-simple-services",
        "gui-applications",
        "hard-real-time-control",
        "hard-real-time-systems",
        "healthcare",
        "healthcare-integration",
        "healthcare-medical",
        "heavy-plugin-interdependencies",
        "heterogeneous-systems",
        "hierarchical-task-decomposition",
        "high-concurrency",
        "high-dimensional-pattern-recognition",
        "high-frequency-trading",
        "high-scaling-distributed",
        "high-scaling-needs",
        "high-throughput-streaming",
        "high-throughput-trading",
        "high-traffic",
        "high-traffic-portals",
        "high-traffic-systems",
        "highly-configurable-platforms",
        "highly-interactive-ui",
        "human-oversight-systems",
        "ide-browsers",
        "image-processing",
        "industrial-automation",
        "insurance",
        "interactive-ui",
        "internal-services-where-direct-communication-suffices",
        "internal-tools",
        "inventory-management",
        "iot",
        "iot-data-ingestion",
        "iot-data-processing",
        "iot-device-management",
        "iot-industrial",
        "iot-sensor-data",
        "iot-sensor-networks",
        "iot-sensor-processing",
        "kubernetes",
        "large-scale-distributed-systems",
        "large-teams",
        "latency-sensitive-extreme",
        "ledger-bookkeeping",
        "legacy-modernization",
        "legacy-system-integration",
        "legal",
        "legal-compliance",
        "legal-regulatory",
        "limited-operational-maturity",
        "log-analysis",
        "long-lived-applications",
        "long-running-processes",
        "long-running-systems",
        "low-budget",
        "low-complexity-projects",
        "low-complexity-single-service",
        "low-concurrency-single-node-apps",
        "low-concurrency-systems",
        "low-data-implicit-patterns",
        "low-data-volume-monitoring",
        "low-data-volume-scenarios",
        "low-history-requirements",
        "low-latency",
        "low-latency-critical-systems",
        "low-latency-local-calls",
        "low-latency-local-operations",
        "low-latency-real-time",
        "low-latency-required",
        "low-latency-requirements",
        "low-latency-requirements-that-cannot-tolerate-additional-hop",
        "low-maturity",
        "low-ml-requirements",
        "low-traffic",
        "low-traffic-applications",
        "loyalty-programs",
        "manufacturing",
        "media-processing",
        "mergers-acquisitions",
        "messaging-systems",
        "microservices",
        "microservices-architecture",
        "microservices-architectures",
        "microservices-architectures-with-multiple-backend-services",
        "microservices-communication",
        "microservices-ecosystem",
        "microservices-ready",
        "microservices-scale",
        "middleware",
        "minimal-external-integrations",
        "minimal-infrastructure-overhead",
        "ml-engineering",
        "ml-training-pipelines-requiring-global-batch-processing",
        "mobile-applications",
        "mobile-first-applications",
        "monolith-or-fewer-than-3-services",
        "monolith-without-scaling-needs",
        "multi-agent-ai-systems",
        "multi-agent-coordination",
        "multi-bounded-contexts",
        "multi-client-systems",
        "multi-cluster",
        "multi-divisional",
        "multi-external-integrations",
        "multi-protocol-environments",
        "multi-service-business-workflows",
        "multi-team",
        "multi-team-organizations",
        "multi-tenant-platforms",
        "multi-tenant-saas",
        "multi-user-collaborative-systems",
        "multi-window-applications",
        "multiple-services-same-data",
        "multiple-teams",
        "mvp",
        "natural-language-processing",
        "notifications",
        "operating-systems",
        "order-management",
        "organizations-in-heavily-regulated-industries",
        "organizations-with-separate-client-teams",
        "organizations-without-streaming-infrastructure",
        "pattern-recognition",
        "payment-processing",
        "performance-critical-real-time",
        "persistent-websocket-connections",
        "platform-ecosystems",
        "polyglot-persistence-needs",
        "probabilistic-reasoning",
        "product-platforms",
        "projects-with-limited-operational-maturity",
        "prototypes",
        "public-apis-requiring-rate-limiting-and-authentication",
        "purely-synchronous-workloads",
        "queue-processing",
        "random-data-access",
        "rapid-prototyping",
        "rapidly-evolving-domains",
        "real-time-analytics",
        "real-time-analytics-dashboards",
        "real-time-collaborative",
        "real-time-dashboards",
        "real-time-deterministic",
        "real-time-gaming",
        "real-time-interactive-systems",
        "real-time-processing",
        "real-time-systems",
        "real-time-systems-where-any-latency-overhead-is-unacceptable",
        "recommendation-engines",
        "recommendation-systems",
        "regulated-industries",
        "regulatory-compliance",
        "request-response",
        "request-response-apis",
        "resource-constrained-environments",
        "restful-apis",
        "robotic-systems",
        "rule-based-systems",
        "rule-engines",
        "saas-applications-with-multi-tenant-requirements",
        "scheduled-tasks",
        "security-sensitive-without-care",
        "self-healing-systems",
        "sensor-fusion",
        "server-side-rendering",
        "server-side-web-rendering",
        "serverless",
        "session-management-systems",
        "short-duration-transactions-where-2pc-is-feasible",
        "short-lived-projects",
        "signal-processing",
        "simple-applications",
        "simple-crud",
        "simple-crud-applications",
        "simple-domains",
        "simple-local-communication",
        "simple-point-to-point",
        "simple-request-response",
        "simple-single-task-automation",
        "simple-single-view-applications",
        "single-algorithm",
        "single-client-single-service",
        "single-codebase-preferences",
        "single-domain",
        "single-organization",
        "single-persistence-layer",
        "single-service-applications",
        "single-threaded-environments",
        "small-applications",
        "small-loosely-coupled-systems",
        "small-team-projects",
        "small-teams",
        "small-teams-lacking-operational-infrastructure",
        "small-teams-simple-requirements",
        "small-teams-with-low-operational-maturity",
        "small-teams-without-dedicated-infrastructure-ops",
        "small-teams-without-fullstack-capabilities",
        "small-to-medium-scale-data-processing",
        "small-to-medium-teams",
        "smart-cities",
        "smart-retail",
        "space-mission-control",
        "speech-recognition",
        "startup",
        "startup-pocs",
        "startups-early-stage",
        "state-dependent-processing",
        "stateful-compute-intensive-tasks",
        "static-reference-data",
        "static-requirements",
        "steady-predictable-loads",
        "steady-high-traffic",
        "stream-processing",
        "streaming",
        "streaming-analytics-preparation",
        "strict-data-residency-requirements",
        "strict-static-analysis",
        "strong-consistency-required",
        "strong-consistency-requirements",
        "strong-immediate-consistency",
        "strong-transaction",
        "strongly-consistent",
        "strongly-consistent-single-entity",
        "sub-millisecond-response-requirements",
        "supply-chain",
        "systems-requiring-audit-trails",
        "systems-requiring-strong-acid-transactions",
        "systems-requiring-strong-consistency",
        "systems-requiring-strong-consistency-within-modules",
        "systems-requiring-strong-immediate-consistency",
        "systems-with-strong-consistency-requirements",
        "systems-with-very-high-transaction-throughput-requirements",
        "team-experience-low",
        "teams-lacking-operational-expertise",
        "teams-sized-5-50-with-domain-aligned-module-ownership",
        "teams-unfamiliar-with-event-driven-patterns",
        "teams-unfamiliar-with-reflection",
        "teams-with-batch-focused-expertise",
        "teams-with-limited-batch-stream-expertise",
        "teams-without-distributed-systems-expertise",
        "technical-support",
        "telecom-and-real-time-messaging",
        "telecommunications",
        "ticket-booking-systems",
        "tight-coupling-acceptable",
        "tightly-coupled",
        "traditional-web",
        "travel-reservations",
        "ultra-low-latency-requirements",
        "video-analytics",
        "voip-applications",
        "volatile-core-frequent-changes",
        "web-applications",
        "web-servers",
        "webhooks",
        "workflow-systems",
        "write-heavy-low-read-workloads"
      ],
      "description": "Architecture domain for pattern suitability filtering"
    }
  },
  "properties": {
    "category": {
      "type": "string",
      "enum": [
        "messaging",
        "structural",
        "cloud",
        "data",
        "ai_cognitive",
        "specialized",
        "api_gateway",
        "coordination",
        "dataflow",
        "presentation"
      ],
      "description": "Pattern category"
    },
    "name": {
      "type": "string",
      "description": "Pattern name (kebab-case)"
    },
    "context": {
      "type": "string",
      "description": "Problem context describing when this pattern is applicable"
    },
    "benefits": {
      "type": "array",
      "items": {
        "type": "string"
      },
      "description": "List of benefits this pattern provides"
    },
    "tradeoffs": {
      "type": "array",
      "items": {
        "type": "string"
      },
      "description": "List of tradeoffs and disadvantages"
    },
    "quality_attributes": {
      "type": "object",
      "properties": {
        "scalability": {
          "type": "number",
          "minimum": 1,
          "maximum": 10
        },
        "maintainability": {
          "type": "number",
          "minimum": 1,
          "maximum": 10
        },
        "reliability": {
          "type": "number",
          "minimum": 1,
          "maximum": 10
        },
        "security": {
          "type": "number",
          "minimum": 1,
          "maximum": 10
        },
        "performance": {
          "type": "number",
          "minimum": 1,
          "maximum": 10
        },
        "simplicity": {
          "type": "number",
          "minimum": 1,
          "maximum": 10
        }
      },
      "additionalProperties": {
        "type": "number",
        "minimum": 1,
        "maximum": 10
      }
    },
    "suitable_domains": {
      "type": "array",
      "items": {
        "$ref": "#/definitions/architectureDomain"
      },
      "description": "Domains where this pattern works well"
    },
    "unsuitable_domains": {
      "type": "array",
      "items": {
        "$ref": "#/definitions/architectureDomain"
      },
      "description": "Domains where this pattern should be avoided"
    },
    "use_cases": {
      "type": "array",
      "items": {
        "type": "string"
      },
      "description": "Specific use case examples"
    },
    "avoid_when": {
      "type": "array",
      "items": {
        "type": "string"
      },
      "description": "Situations when this pattern should be avoided"
    },
    "component_types": {
      "type": "array",
      "items": {
        "type": "string"
      },
      "description": "Key component types involved in this pattern"
    },
    "technology_stack": {
      "type": "array",
      "items": {
        "type": "string"
      },
      "description": "Technologies commonly used with this pattern"
    },
    "anti_patterns": {
      "type": "array",
      "items": {
        "type": "string"
      },
      "description": "Common anti-patterns to avoid"
    },
    "migration_from": {
      "type": "array",
      "items": {
        "type": "string"
      },
      "description": "Patterns commonly migrated from"
    },
    "migration_to": {
      "type": "array",
      "items": {
        "type": "string"
      },
      "description": "Patterns commonly migrated to"
    },
    "design_principles": {
      "type": "array",
      "items": {
        "type": "string"
      },
      "description": "Core design principles for this pattern"
    },
    "best_practices": {
      "type": "array",
      "items": {
        "type": "string"
      },
      "description": "Recommended best practices"
    }
  }
}